10,unionist, ユニオニストゥ, 組合員, くみあいいん
10,utilitarian, ユーティリテアリアン, 功利主義の, こうりしゅぎの
10,usable, ユーザブル, 使用できる, しようできる
10,molecular, モレキュラー, (化)分子の, (か)ぶんしの
10,moratorium, モラトーリアム, モラトリアム，猶予期間, モラトリアム，ゆうよきかん
10,monotone, モノトウン, 単調，一本調子の話し方, たんちょう，いっぽんぢょうしのはなしかた
10,monumental, モニュメンタル, 堂々とした，不朽の, どうどうとした，ふきゅうの
10,monastery, モナステリー, 修道院，僧院, しゅうどういん，そういん
10,modernism, モダニズム, 現代的思考，現代風, げんだいてきしこう，げんだいふう
10,modernist, モダニストゥ, 現代主義の，近代主義者, げんだいしゅぎの，きんだいしゅぎしゃ
10,mosque, モスク, モスク, モスク
10,malt, モールトゥ, 麦芽，モルト, ばくが，モルト
10,momentous, モウメンタス, 重大な, じゅうだいな
10,motel, モウテル, モーテル, モーテル
10,moisten, モイスン, 湿らせる，潤す, しめらせる，うるおす
10,mortar, モアター, モルタル，モルタルで接合する, モルタル，モルタルでせつごうする
10,mentor, メントア, よき助言者，相談相手, よきじょげんしゃ，そうだんあいて
10,methodology, メソドロジー, 方法論, ほうほうろん
10,methodical, メソディカル, きちょうめんな, きちょうめんな
10,maniac, メイニアック, 狂人，熱狂家, マニア，ねっきょうか
10,mania, メイニア, マニア，躁病, マニア，そうびょう
10,mince, ミンス, 控えめに言う，遠回しに言う, ひかえめにいう，とおまわしにいう
10,militia, ミリシャ, 市民軍，民兵, しみんぐん，みんぺい
10,mutation, ミューテイション, 変化，突然変異, へんか，とつぜんへんい
10,minimal, ミニマル, 最小の，最小, さいしょうの，さいしょう
10,meticulous, ミティキュラス, 細心の，非常に注意深い, さいしんの，ひじょうにちゅういぶかい
10,mediation, ミディエイション, 調停，和解, ちょうてい，わかい
10,mishap, ミスハップ, 不幸，不運, ふこう，ふうん
10,mystic, ミスティク, 神秘主義者，秘伝の, しんぴしゅぎしゃ，ひでんの
10,misconduct, ミスコンダクトゥ, 非行，姦通, ひこう，かんつう
10,mythical, ミシカル, 神話的な, しんわてきな
10,mundane, マンデイン, 世俗的な，ありふれた, せぞくてきな，ありふれた
10,mandate, マンデイトゥ, の統治を委任する，命令, のとうちをいにんする，めいれい
10,mandatory, マンダトリー, 強制的な，命令の, きょうせいてきな，めいれいの
10,maritime, マリタイム, 海運上の，海の, かいうんじょうの，うみの
10,malignant, マリグナントゥ, 悪意のある，悪質な, あくいのある，あくしつな
10,managerial, マネジリアル, 経営の, けいえいの
10,manageable, マネイジャブル, 御しやすい，扱いやすい, ぎょしやすい，あつかいやすい
10,manure, マニュアー, こやし，肥料, こやし，ひりょう
10,muddle, マドゥル, 混乱，ごたごた, こんらん，ごたごた
10,matching, マッチング, 釣り合う，揃いの, つりあう，そろいの
10,mug, マッグ, (人を暗闇で)襲って金品を奪う，がり勉する, (ひとをくらやみで)おそってきんぴんをうばう，がりつとむする
10,maternity, マターニティー, 母性，母であること, ぼせい，ははであること
10,muster, マスタア, (勇気を)奮い起こす，召集する, (ゆうきを)ふるいおこす，しょうしゅうする
10,motherly, マザリー, 母の，母のような, ははの，ははのような
10,magnificence, マグニフィセンス, 壮大，荘厳な雰囲気, そうだい，そうごんなふんいき
10,mountaineer, マウンテニアー, 山の住人，登山家, やまのじゅうにん，とざんか
10,minutely, マイニュートゥリイ, 細かく, こまかく
10,microscopic, マイクロスコピック, 微視的な，顕微鏡でやっと見えるほどの, びしてきな，けんびきょうでやっとみえるほどの
10,migrant, マイグラントゥ, 移住者，移住性の, いじゅうしゃ，いじゅうせいの
10,mermaid, マーメイドゥ, (女の)人魚，女子水泳選手, (おんなの)にんぎょ，じょしすいえいせんしゅ
10,martyr, マーター, 殉教者，犠牲者, じゅんきょうしゃ，ぎせいしゃ
10,margarine, マージァリーン, マーガリン，人造バター, マーガリン，じんぞうバター
10,volley, ボレイ, ボレーで打ちかえす，いっせいに飛ぶ, ボレーでうちかえす，いっせいにとぶ
10,bolster, ボルスター, 強める，支持(する), つよめる，しじ(する)
10,politic, ポリティック, 抜け目のない, ぬけめのない
10,volatile, ボラタイル, 揮発性の，爆発しやすい, きはつせいの，ばくはつしやすい
10,potter, ポター, 陶工，焼き物師, とうこう，やきものし
10,hog, ホグ, 大型車，ブタ, おおがたしゃ，ブタ
10,haunted, ホーンティドゥ, 幽霊の良く出る, ゆうれいのよくでる
10,pawn, ポーン, 人質，担保, ひとじち，たんぽ
10,vault, ボールトゥ, 金庫，貴重品保管室, きんこ，きちょうひんほかんしつ
10,hoard, ホードゥ, 貯蔵(する)，買いだめ(する), ちょぞう(する)，かいだめ(する)
10,haughty, ホーティー, おうへいな，傲慢な, おうへいな，ごうまんな
10,porcelain, ポースリン, 磁器製の，磁器, じきせいの，じき
10,boyish, ボーイッシュ, 男の子らしい, おとこのこらしい
10,bony, ボウニー, 骨の(ような)，骨ばった, ほねの(ような)，ほねばった
10,poker, ポウカー, 突く人(物)，火かき, つくひと(もの)，ひかき
10,whim, ホィム, 気まぐれ，気まぐれな思いつき, きまぐれ，きまぐれなおもいつき
10,poise, ポイズ, 安定，平衡, あんてい，へいこう
10,pendulum, ペンデュラム, (時計などの)振り子，動揺するもの, (とけいなどの)ふりこ，どうようするもの
10,ventilate, ベンティレイトゥ, 換気する，空気にあてる, かんきする，くうきにあてる
10,pendant, ペンダントゥ, ペンダント，つりランプ, ペンダント，つりランプ
10,bellow, ベロウ, 大声でどなる, おおごえでどなる
10,helm, ヘルム, かじ，操舵装置, かじ，そうだそうち
10,peripheral, ペリフェラル, 周辺の，末梢性の, しゅうへんの，まっしょうせいの
10,venerable, ベネラブル, 尊敬に値する，神聖な, そんけいにあたいする，しんせいな
10,benevolent, ベネボレントゥ, 慈悲深い, じひぶかい
10,beneficiary, ベネフィシヤリー, 受取人，受給者, うけとりにん，じゅきゅうしゃ
10,venue, ベニュー, 集合場所，会場, しゅうごうばしょ，かいじょう
10,penis, ペニス, ペニス，チンポ, ペニス，チンポ
10,petticoat, ペティコウトゥ, ペチコート，短いスカート, ペチコート，みじかいスカート
10,pep, ペップ, 元気，活力, げんき，かつりょく
10,vex, ベックス, いらいらさせる，なやませる, いらいらさせる，なやませる
10,beckon, ベコン, 手招きする，(身振りで)招く, てまねきする，(みぶりで)まねく
10,hectare, ヘクタール, ヘクタール, ヘクタール
10,hale, ヘイル, (老人)強壮な，かくしゃくとした, (ろうじん)きょうそうな，かくしゃくとした
10,beige, ベイジ, ベージュ, ベージュ
10,proliferation, プロリファレイション, 増殖，急増, ぞうしょく，きゅうぞう
10,promenade, プロムナードゥ, 散歩する，遊歩, さんぽする，ゆうほ
10,proportionate, プロポーショナトゥ, 比例した, ひれいした
10,proponent, プロポウネントゥ, 提案者，弁護者, ていあんしゃ，べんごしゃ
10,provocative, プロボウカティブ, 刺激する，怒らせる, しげきする，おこらせる
10,propriety, プロプライエティー, 礼儀正しさ，礼儀正しいこと, れいぎただしさ，れいぎただしいこと
10,proverbial, プロバービアル, ことわざの，有名な, ことわざの，ゆうめいな
10,protectionism, プロテクショニズム, 保護貿易主義, ほごぼうえきしゅぎ
10,flop, フロップ, 失敗，ばたりと倒れる, しっぱい，ばたりとたおれる
10,floppy, フロッピ, だらりと垂れた，弱い, だらりとたれた，よわい
10,prod, プロッドゥ, 刺激する，つつく, しげきする，つつく
10,bloc, ブロック, ブロック，団体, ブロック，だんたい
10,frosty, フロスティー, 凍りつくような, こおりつくような
10,broth, ブロス, 薄いスープ, うすいスープ
10,projector, プロジェクター, 映写機，企画者, えいしゃき，きかくしゃ
10,proximity, プロクシミティー, 近接，近似, きんせつ，きんじ
10,proxy, プロクシー, 代理(権/人)，委任状, だいり(けん/ひと)，いにんじょう
10,procure, プロキュアー, 売春婦を周旋する，獲得する, ばいしゅんふをしゅうせんする，かくとくする
10,prawn, プローン, クルマエビ，クルマエビを捕える, クルマエビ，クルマエビをとらえる
10,fraught, フロートゥ, 伴った，充満した, ともなった，じゅうまんした
10,plausible, プローシブル, もっともらしい，口先のうまい, もっともらしい，くちさきのうまい
10,bloke, ブロウク, 奴, やつ
10,flooring, フロアリング, 床，床張り(材料), ゆか，ゆかばり(ざいりょう)
10,frenzy, フレンジー, 激しい興奮，興奮のるつぼ, はげしいこうふん，こうふんのるつぼ
10,premiere, プレミア, 初日，主要な, しょにち，しゅような
10,predator, プレディター, 食肉動物，略奪者, しょくにくどうぶつ，りゃくだつしゃ
10,fret, フレットゥ, 腐食する，むしばむ, ふしょくする，むしばむ
10,pleasurable, プレジャラブル, 愉快な, ゆかいな
10,braid, ブレイドゥ, 組ひも，さなだひも, くみひも，さなだひも
10,fray, フレイ, 論争，口論, ろんそう，こうろん
10,flare, フレアー, ゆらゆら燃える，かっと怒り出す, ゆらゆらもえる，かっとおこりだす
10,bourgeois, ブルジョワー, 中産階級の(人)，資本主義の, ちゅうさんかいきゅうの(ひと)，しほんしゅぎの
10,brutality, ブルータリティー, 横暴さ, おうぼうさ
10,brewery, ブルウアリー, ビール醸造所，醸造所, ビールじょうぞうじょ，じょうぞうじょ
10,brewer, ブルーアー, 醸造者, じょうぞうしゃ
10,flint, フリントゥ, 非常に堅い物，ライターの石, ひじょうにかたいもの，ライターのいし
10,frill, フリル, フリルを付ける，フリル, フリルをつける，フリル
10,predictive, プリディクティブ, 前兆となる，予言的な, ぜんちょうとなる，よげんてきな
10,flick, フリック, 軽く打つこと，映画, かるくうつこと，えいが
10,flicker, フリッカー, 点滅ライト，点滅する, てんめつライト，てんめつする
10,bristle, ブリスル, こわ毛，剛毛, こわけ，ごうもう
10,presumption, プリザンプション, 見込み，推定, みこみ，すいてい
10,brigade, ブリゲイドゥ, 旅団，編成する, りょだん，へんせいする
10,preclude, プリクルードゥ, 不可能にする，除外する, ふかのうにする，じょがいする
10,bland, ブランドゥ, 人当たりがよい，穏やかな, ひとあたりがよい，おだやかな
10,franchise, フランチャイズ, フランチャイズ，特権, フランチャイズ，とっけん
10,plunder, プランダー, 略奪，略奪品, りゃくだつ，りゃくだつひん
10,blunder, ブランダー, 不注意な失敗，大失敗(する), ふちゅういなしっぱい，だいしっぱい(する)
10,flank, フランク, 側面に立つ，横腹, そくめんにたつ，よこばら
10,flowering, フラワリング, 花の咲いている，開花, はなのさいている，かいか
10,brag, ブラッグ, 自慢する，大げさに言い立てる, じまんする，おおげさにいいたてる
10,flattering, フラタリング, へつらいの，いい気にさせる, へつらいの，いいきにさせる
10,fraternity, フラタニティー, 同業者仲間，共済組合, どうぎょうしゃなかま，きょうさいくみあい
10,bladder, ブラダ, 空気袋，ぼうこう, くうきぶくろ，ぼうこう
10,fragmentary, フラグメンタリー, 断片的な，破片の, だんぺんてきな，はへんの
10,practicable, プラクティカブル, 実行可能な，通行できる, じっこうかのうな，つうこうできる
10,fracture, フラクチュァ, 骨折する，骨折, こっせつする，こっせつ
10,prowl, プラウル, うろつく, うろつく
10,primal, プライマル, 原始の，根本の, げんしの，こんぽんの
10,plight, プライトゥ, 苦境，窮地, くきょう，きゅうち
10,bridal, ブライダル, 花嫁の, はなよめの
10,flirt, フラートゥ, 異性に対して面白半分に気を引く, いせいにたいしておもしろはんぶんにきをひく
10,boutique, ブティーク, ブティック, ブティック
10,faulty, フォールティー, 欠陥のある，不完全な, けっかんのある，ふかんぜんな
10,phony, フォーニー, 偽の，まやかし(の), にせの，まやかし(の)
10,fortress, フォートゥレス, 安全地域，要塞, あんぜんちいき，ようさい
10,fortify, フォーティファイ, の防衛を強化する，固める, のぼうえいをきょうかする，かためる
10,forge, フォージ, 形作る，溶鉄炉, かたちづくる，ようてつろ
10,focal, フォウカル, 焦点の, しょうてんの
10,ferocious, フェロウシャス, 恐ろしい, おそろしい
10,ferret, フェレトゥ, 捜し出す，フェレット, さがしだす，フェレット
10,phoenix, フェニックス, 不死鳥，不滅の人, ふしちょう，ふめつのひと
10,feign, フェイン, のふりをする，装う, のふりをする，よそおう
10,facing, フェイシング, 上塗り，向く, うわぬり，むく
10,booster, ブースター, 昇圧器, しょうあつき
10,fidelity, フィデリティー, 忠実, ちゅうじつ
10,fixing, フィクシング, 器具，固定, きぐ，こてい
10,figurative, フィギュラティブ, 比喩的な, ひゆてきな
10,fume, フィゥーム, 蒸発する，煙, じょうはつする，けむり
10,feudalism, フィゥーダリズム, 封建制度, ほうけんせいど
10,fuse, フィゥーズ, ヒューズ，信管, ヒューズ，しんかん
10,fugitive, フィゥージティブ, 変わりやすい，逃亡者, かわりやすい，とうぼうしゃ
10,feasible, フィージブル, 実現可能な，可能な, じつげんかのうな，かのうな
10,fumble, ファンブル, 不器用に手で捜す，手探りする, ぶきようにてでさがす，てさぐりする
10,fungus, ファンガス, 菌(類)，キノコ, きん(たぐい)，キノコ
10,fabricate, ファブリケイトゥ, 組み立てる，(物語・嘘を)作る, くみたてる，(ものがたり・うそを)つくる
10,fanatic, ファナティック, 狂信者，熱狂的信者, きょうしんしゃ，ねっきょうてきしんじゃ
10,fatty, ファティー, 脂肪質の，油っこい, しぼうしつの，あぶらっこい
10,facile, ファシル, 愛想のよい，手軽な, あいそのよい，てがるな
10,facet, ファシットゥ, 面，様相, めん，ようそう
10,facade, ファサードゥ, 建物正面の壁面，(比喩的に)前面, たてものしょうめんのへきめん，(ひゆてきに)ぜんめん
10,firing, ファイアリング, 発射する, はっしゃする
10,fervor, ファーバー, 熱烈，白熱, ねつれつ，はくねつ
10,vintage, ビンテイジ, (ある特定地域・時期の)ぶどう酒，古くて価値のあるもの, (あるとくていちいき・じきの)ぶどうさけ，ふるくてかちのあるもの
10,bingo, ビンゴー, 当たり，ビンゴ, あたり，ビンゴ
10,buildup, ビルドゥアップ, (兵力・体力・産業)増強，強化, (へいりょく・たいりょく・さんぎょう)ぞうきょう，きょうか
10,bureaucratic, ビューロクラティック, お役所的な，官僚的な, おやくしょてきな，かんりょうてきな
10,bureaucrat, ビューロクラットゥ, 官僚, かんりょう
10,hue, ヒュー, 色合い，色, いろあい，いろ
10,bibliography, ビブリオグラフィー, 参考文献，文献目録, さんこうぶんけん，ぶんけんもくろく
10,benign, ビナイン, 良性の，恵み深い, りょうせいの，めぐみふかい
10,pitiless, ピティレス, 無慈悲な，情け容赦ない, むじひな，なさけようしゃない
10,hideous, ヒディアス, 見るも恐ろしい，ぞっとする, みるもおそろしい，ぞっとする
10,beset, ビセットゥ, 包囲する，取り巻く, ほういする，とりまく
10,hysteria, ヒステリア, ヒステリー, ヒステリー
10,vista, ビスタ, 展望，眺望, てんぼう，ちょうぼう
10,piss, ピス, 小便する, しょうべんする
10,visionary, ビジョナリー, 幻の，非現実的な, まぼろしの，ひげんじつてきな
10,visibility, ビジビリティー, 見通し, みとおし
10,besiege, ビシージ, 包囲攻撃する，包囲する, ほういこうげきする，ほういする
10,pygmy, ピグミー, 小人, こびと
10,vicar, ビカー, (英国国教会の)教区牧師，(教皇・司祭の)代理, (えいこくこっきょうかいの)きょうくぼくし，(きょうこう・しさいの)だいり
10,veal, ビール, 子牛の肉, こうしのにく
10,heave, ヒーブ, 力をいれて持ちあげる，あえぎ, ちからをいれてもちあげる，あえぎ
10,penal, ピーナル, 刑事上の，刑(法)の, けいじじょうの，けい(ほう)の
10,bead, ビードゥ, 数珠玉，ビーズ, じゅずだま，ビーズ
10,veto, ビートウ, 拒否する，拒否権, きょひする，きょひけん
10,bumpy, バンピー, (道路)でこぼこの，(車・旅行)がたつく, (どうろ)でこぼこの，(くるま・りょこう)がたつく
10,hamper, ハンパー, 妨げる，邪魔する, さまたげる，じゃまする
10,handiwork, ハンディワーク, 手細工(品), てざいく(ひん)
10,punk, パンク, パンクファッション(の人)，くだらぬもの, パンクファッション(のひと)，くだらぬもの
10,parody, パロディー, 替え歌，パロディ, かえうた，パロディ
10,parenthesis, パレンセシス, かっこ，挿入語句, かっこ，そうにゅうごく
10,pulpit, パルピットゥ, 説教壇, せっきょうだん
10,bulge, バルジ, ふくらませる，膨らむ, ふくらませる，ふくらむ
10,variant, バリアントゥ, 異なった，相違する, ことなった，そういする
10,paralysis, パラリシス, 麻痺，中風, まひ，ちゅうぶう
10,parameter, パラメター, パラメーター，変数, パラメーター，へんすう
10,paradigm, パラダイム, 語形変化表，パラダイム, ごけいへんかひょう，パラダイム
10,havoc, ハボック, 大破壊，大混乱, だいはかい，だいこんらん
10,purport, パポートゥ, 主旨，意味, しゅし，いみ
10,pervasive, パベイシブ, 普及する，広がる, ふきゅうする，ひろがる
10,baptism, バプティズム, 洗礼, せんれい
10,baptize, バプタイズ, 洗礼を施す，洗礼する, せんれいをほどこす，せんれいする
10,performing, パフォーミング, 芸当のできる，公演を要する, げいとうのできる，こうえんをようする
10,buff, バフ, 打撃，～狂, だげき，〜きょう
10,pervert, パバートゥ, 変質者，悪用する, へんしつしゃ，あくようする
10,huddle, ハドゥル, 集まる，身を寄せ合う, あつまる，みをよせあう
10,padding, パディング, つけ足し，パッド, つけたし，パッド
10,particularity, パティキュラリティー, 特別，特殊性, とくべつ，とくしゅせい
10,baffle, バッフル, まごつかせる，挫折, まごつかせる，ざせつ
10,butt, バットゥ, (獣が)角で激しく突く，尻, (けものが)かくではげしくつく，しり
10,bustle, バッスル, 忙しく動き回る，にぎわい, いそがしくうごきまわる，にぎわい
10,bash, バッシュ, 大打撃，強打する, だいだげき，きょうだする
10,hack, ハック, たたき切る，刻み目, たたききる，きざみめ
10,paternal, パターナル, 父親らしい，温情主義, ちちおやらしい，おんじょうしゅぎ
10,pastel, パステル, パステル画，パステル(調の), パステルが，パステル(ちょうの)
10,bastard, バスタードゥ, 野郎，偽物, やろう，にせもの
10,pacifist, パシフィストゥ, 平和主義者, へいわしゅぎしゃ
10,pageant, パジェントゥ, ページェント，野外劇, ページェント，やがいげき
10,bacterial, バクテリアル, バクテリアの, バクテリアの
10,bout, バウトゥ, 勝負，(ボクシングの)試合, しょうぶ，(ボクシングの)しあい
10,powdery, パウダリー, 粉末状の, ふんまつじょうの
10,vile, バイル, 下劣な，ひどく悪い, げれつな，ひどくわるい
10,hype, ハイプ, 詐欺，誇大な宣伝・広告(をする), さぎ，こだいなせんでん・こうこく(をする)
10,hierarchical, ハイアラーキカル, 階級の, かいきゅうの
10,viable, バイアブル, 生存できる，実行可能な, せいぞんできる，じっこうかのうな
10,perplexity, パープレクシティー, 当惑，途方に暮れること, とうわく，とほうにくれること
10,herbal, ハーバル, ハーブの，(薬)草の, ハーブの，(くすり)くさの
10,varnish, バーニッシュ, ニス(を塗る), ニス(をぬる)
10,pertain, パーテイン, 関係がある，属する, かんけいがある，ぞくする
10,pertinent, パーティネントゥ, (直接)関係がある，適切な, (ちょくせつ)かんけいがある，てきせつな
10,partisan, パーティザン, 党員，ゲリラ隊員の, とういん，ゲリラたいいんの
10,parch, パーチ, からからにする，あぶる, からからにする，あぶる
10,perspiration, パースピレイション, 努力，汗, どりょく，あせ
10,barge, バージ, 遊覧船，荷船, ゆうらんせん，にせん
10,versatile, バーサタイル, 多方面な，多才な, たほうめんな，たさいな
10,nominee, ノミニー, 任命された人, にんめいされたひと
10,nomadic, ノマディク, 遊牧の, ゆうぼくの
10,notch, ノッチ, 切り目(をつける)，刻み目(をいれる), きりめ(をつける)，きざみめ(をいれる)
10,nostalgia, ノスタルジア, 郷愁，ノスタルジア, きょうしゅう，ノスタルジア
10,necessitate, ネセシテイトゥ, 強いて~させる，必要にする, しいて~させる，ひつようにする
10,neon, ネオン, ネオン, ネオン
10,nymph, ニンフ, ニンフ(神話)，少女の姿の半神半人・山・川・木などに住む妖精, ニンフ(しんわ)，しょうじょのすがたのはんしんはんにん・やま・かわ・きなどにすむようせい
10,neutron, ニュートゥロン, 中性子, ちゅうせいし
10,neurotic, ニューアラティック, ノイローゼにかかった，神経(症)の, ノイローゼにかかった，しんけい(しょう)の
10,nuance, ニュアンス, ニュアンス, ニュアンス
10,niche, ニッチ, (人・物の)適所，適性, (ひと・ものの)てきしょ，てきせい
10,numb, ナム, の感覚をなくす，感覚を失った, のかんかくをなくす，かんかくをうしなった
10,naturalist, ナチュラリストゥ, 動(植)物学者，博物学者, どう(しょく)ものがくしゃ，はくぶつがくしゃ
10,narcotic, ナーコティック, 眠気を催すような，麻酔性の, ねむけをもよおすような，ますいせいの
10,dominion, ドミニョン, 支配権，主権, しはいけん，しゅけん
10,topple, トプル, 倒れる，ぐらつく, たおれる，ぐらつく
10,toddler, トドゥラー, よちよち歩きの幼児，歩き始めの子, よちよちあるきのようじ，あるきはじめのこ
