7,foggy, フォギー, 霧がかかった，霧の深い, きりがかかった，きりのふかい
7,forum, フォーラム, 評議会，大広場, ひょうぎかい，だいひろば
7,formulate, フォーミュレイトゥ, 定式化する, ていしきかする
7,formidable, フォーミダブル, 恐ろしい，圧倒的な, おそろしい，あっとうてきな
7,forsake, フォーセイク, やめる，捨てる, やめる，すてる
7,forthcoming, フォースカミング, 近くにやってくる，すぐ手に入る, ちかくにやってくる，すぐてにはいる
7,folklore, フォウクロア, 民話，民間伝承, みんわ，みんかんでんしょう
7,foe, フォウ, 敵，仇, てき，あだ
7,feminine, フェミニン, 女性(の), じょせい(の)
7,hoof, フーフ, ひづめ，足, ひづめ，あし
7,fiscal, フィスカル, 国庫収入の，財政上の, こっこしゅうにゅうの，ざいせいじょうの
7,fig, フィグ, イチジク，取るに足らぬもの, イチジク，とるにたらぬもの
7,fury, フィゥーリー, 憤慨，激怒, ふんがい，げきど
7,furious, フィゥーリアス, すさまじい，狂った, すさまじい，くるった
7,feverish, フィーバリッシュ, 熱のある，熱病の(多い), ねつのある，ねつびょうの(おおい)
7,feedback, フィードゥバック, 帰ってくる意見・反応・情報，手ごたえ, かえってくるいけん・はんのう・じょうほう，てごたえ
7,feeder, フィーダー, 飼養者，食べる人, しようしゃ，たべるひと
7,functional, ファンクショナル, 機能の, きのうの
7,fahrenheit, ファランハイトゥ, 華氏，華氏温度, かし，かしおんど
7,fabric, ファブリック, 織物，布, おりもの，ぬの
7,fascination, ファシネイション, うっとりした状態，魅惑, うっとりしたじょうたい，みわく
7,factual, ファクチュアル, 事実上の，事実の, じじつじょうの，じじつの
7,fiery, ファイアリー, 火の, ひの
7,pharmacist, ファーマシストゥ, 薬剤師, やくざいし
7,furnace, ファーネス, 厳しい試練，炉, きびしいしれん，ろ
7,fasting, ファースティング, 絶食，断食, ぜっしょく，だんじき
7,projection, プ・鴻Wェクション, 投影，発射, とうえい，はっしゃ
7,hindrance, ヒンドゥランス, 妨害，障害, ぼうがい，しょうがい
7,hinder, ヒンダー,(1)ヒﾝﾀﾞ-を妨げる，(2)ハｲﾝﾀﾞ-後の,(1)ヒﾝﾀﾞ-をさまたげる，(2)ハｲﾝﾀﾞ-あとの
7,belated, ビレイティドゥ, 遅れて到着した，手遅れになった, おくれてとうちゃくした，ておくれになった
7,humility, ヒュミリティー, けんそん，謙遜, けんそん，けんそん
7,bureaucracy, ビューロクラシー, 官僚政治，官僚主義, かんりょうせいじ，かんりょうしゅぎ
7,humid, ヒューミッドゥ, 湿度の高い，湿気の多い, しつどのたかい，しっきのおおい
7,behold, ビホウルドゥ, 見る, みる
7,pitiful, ピティフル, 哀れな，哀れみを誘う, あわれな，あわれみをさそう
7,bid, ビッドゥ, 提案，入札, ていあん，にゅうさつ
7,bestow, ビストウ, 与える，授ける, あたえる，さずける
7,picturesque, ピクチュアーレスク, 絵のように美しい，人目をひく, えのようにうつくしい，ひとめをひく
7,victor, ビクター, 勝利者，征服者, しょうりしゃ，せいふくしゃ
7,beware, ビウェアー, 用心する，注意する, ようじんする，ちゅういする
7,heed, ヒードゥ, 注意を払う，気をつける, ちゅういをはらう，きをつける
7,piercing, ピアシング, つんざく，大声の, つんざく，おおごえの
7,hereafter, ヒアアフター, 今後(は), こんご(は)
7,hiss, ヒ・X, シューと音をだす，しっと言う, シューとおとをだす，しっという
7,handshake, ハンドゥシェイク, 握手, あくしゅ
7,bandage, バンディッジ, 包体，包帯, つつみからだ，ほうたい
7,handicraft, ハンディクラフトゥ, 手先の熟練, てさきのじゅくれん
7,bankruptcy, バンクラプトゥシー, 倒産, とうさん
7,ballot, バロットゥ, 投票用紙，投票(する), とうひょうようし，とうひょう(する)
7,valve, バルブ, バルブ，弁, バルブ，べん
7,pulse, パルス, パルス，脈, パルス，みゃく
7,vulgar, バルガー, 下品な，野卑な, げひんな，やひな
7,barricade, バリケイドゥ, 妨害するもの，障害物, ぼうがいするもの，しょうがいぶつ
7,variable, バリアブル, 変わりやすい，気まぐれな, かわりやすい，きまぐれな
7,paralyze, パラライズ, 麻痺させる，無効にする, まひさせる，むこうにする
7,harmonious, ハモニアス, 調和の取れた，和声の, ちょうわのとれた，わせいの
7,buffet, バフェイ, 打撃，(風波・運命の)翻弄, だげき，(ふうは・うんめいの)ほんろう
7,panorama, パノラマ, 全景，概観, ぜんけい，がいかん
7,partake, パテイク, 加わる，参加する, くわわる，さんかする
7,bachelor, バッチラー, 独身の男性，独身の男, どくしんのだんせい，どくしんのおとこ
7,hatch, ハッチ, (ひなを)かえす，昇降口, (ひなを)かえす，しょうこうぐち
7,hush, ハッシュ, 落ち着かせる，静けさ, おちつかせる，しずけさ
7,backing, バッキング, 裏うち，逆行, うらうち，ぎゃっこう
7,pathetic, パセティック, 哀れな，感傷的な, あわれな，かんしょうてきな
7,pastor, パスター, 牧師, ぼくし
7,husky, ハスキー, 殻の(多い)，しゃがれ声の, からの(おおい)，しゃがれこえの
7,persuasion, パスェイジョン, 説得, せっとく
7,persuasive, パスェイシブ, 説得力のある，口のうまい, せっとくりょくのある，くちのうまい
7,hazard, ハザードゥ, 危険にさらす，危険, きけんにさらす，きけん
7,hound, ハウンドゥ, 猟犬で狩る，猟犬, りょうけんでかる，りょうけん
7,pouch, パウチ, 小袋，袋, しょうぶくろ，ふくろ
7,bowel, バウアル, 腸，内臓, ちょう，ないぞう
7,bough, バウ, 大枝，主枝, おおえだ，しゅえだ
7,hind, ハインドゥ, 後部の，後ろの, こうぶの，うしろの
7,binding, バインディング, 縛る(こと)，拘束力のある, しばる(こと)，こうそくりょくのある
7,bimonthly, バイマンスリー, 隔月の，一月おきの, かくげつの，いちがつおきの
7,hypothesis, ハイポセシス, 前提，仮説, ぜんてい，かせつ
7,vibrate, バイブレイトゥ, 振動する，揺れる, しんどうする，ゆれる
7,hive, ハイブ, ミツバチの巣箱, ミツバチのすばこ
7,bypass, バイパス, 迂回する，バイパス, うかいする，バイパス
7,heighten, ハイトゥン, 高める，高くする, たかめる，たかくする
7,hydrogen, ハイドゥロジェン, 水素，元素記号H, すいそ，げんそきごうH
7,hijack, ハイジャック, 乗っ取る，強奪する, のっとる，ごうだつする
7,pious, パイアス, 信心深い，偽善的な, しんじんぶかい，ぎぜんてきな
7,bias, バイアス, バイアス，傾向, バイアス，けいこう
7,burnt, バーントゥ, 燃やした，焼けた, もやした，やけた
7,hurl, ハール, 投げつける，力いっぱい投げつける, なげつける，ちからいっぱいなげつける
7,barley, バーリー, 大麦, おおむぎ
7,perpetual, パーペチュアル, 絶え間ない，永久の, たえあいだない，えいきゅうの
7,barbarian, バーベアリアン, 未開人の，未開人, みかいじんの，みかいじん
7,halve, ハーブ, 等分する，半減させる, とうぶんする，はんげんさせる
7,verbal, バーバル, 言葉の，語の, ことばの，ごの
7,hurdle, ハードゥル, 障害物，乗り越える, しょうがいぶつ，のりこえる
7,heartily, ハーティリー, 心から，元気よく, こころから，げんきよく
7,vertical, バーティカル, 垂直な，垂直の, すいちょくな，すいちょくの
7,hearty, ハーティー, 腹のそこから，食欲が旺盛な, はらのそこから，しょくよくがおうせいな
7,virtually, バーチュアリー, 事実上，実質的には, じじつじょう，じっしつてきには
7,virtuous, バーチュアス, 高潔な，有徳の, こうけつな，ゆうとくの
7,parsley, パースリー, パセリ, パセリ
7,hearth, ハース, 暖炉の前，炉, だんろのまえ，ろ
7,nominate, ノミネイトゥ, (候補者として)指名する，推薦する, (こうほしゃとして)しめいする，すいせんする
7,knob, ノブ, ノブを付ける，ノブ, ノブをつける，ノブ
7,notwithstanding, ノットウィズスタンディング, それにもかかわらず, それにもかかわらず
7,notable, ノウタブル, 注目に値する，著しい, ちゅうもくにあたいする，いちじるしい
7,negligence, ネグリジェンス, 無頓着，投げやり, むとんちゃく，なげやり
7,knowledgeable, ナレジャブル, 知性のある，よく知っている, ちせいのある，よくしっている
7,nourish, ナリッシュ, 栄養分を与える，養う, えいようぶんをあたえる，やしなう
7,navigate, ナビゲイトゥ, 航行する，(船・飛行機を)操縦する, こうこうする，(ふね・ひこうきを)そうじゅうする
7,navigator, ナビゲイター, ナビゲーター，航海長, ナビゲーター，こうかいちょう
7,knuckle, ナックル, げんこつ，指のふし, げんこつ，ゆびのふし
7,nationalism, ナショナリズム, 民族主義，愛国心, みんぞくしゅぎ，あいこくしん
7,nationalize, ナショナライズ, 国有国営にする, こくゆうこくえいにする
7,tolerant, トレラントゥ, 寛大な, かんだいな
7,tolerance, トレランス, 寛容，寛大, かんよう，かんだい
7,tolerable, トレラブル, 我慢できる，耐えられる, がまんできる，たえられる
7,donate, ドネイトゥ, 寄付(寄贈)する, きふ(きぞう)する
7,dogmatic, ドクマティク, 独断的な，教義上の, どくだんてきな，きょうぎじょうの
7,doctrine, ドクトゥリン, 主義，教義, しゅぎ，きょうぎ
7,toll, トール, 死傷者数，損害, ししょうしゃすう，そんがい
7,dormitory, ドーミトリー, 寄宿舎，寮, きしゅくしゃ，りょう
7,talkative, トーカティブ, おしゃべりな，話し好きの, おしゃべりな，はなしすきの
7,treasurer, トゥレジャラー, 会計係，出納係, かいけいがかり，すいとうがかり
7,trainee, トゥレイニー, 練習生, れんしゅうせい
7,traitor, トゥレイター, 裏切り者，反逆者, うらぎりもの，はんぎゃくしゃ
7,tribute, トゥリビュートゥ, 賛辞，弔辞, さんじ，ちょうじ
7,tricky, トゥリッキー, 扱いにくい，巧妙な, あつかいにくい，こうみょうな
7,dreamy, ドゥリーミー, 夢のような, ゆめのような
7,trample, トゥランプル, 踏みつけること，踏む, ふみつけること，ふむ
7,tramp, トゥランプ, 足音高く歩く，激しく踏みつける, あしおとたかくあるく，はげしくふみつける
7,tranquil, トゥランクィル, のどかな，静かな, のどかな，しずかな
7,tram, トゥラム, 市街電車，路面電車, しがいでんしゃ，ろめんでんしゃ
7,drastic, ドゥラスティック, 徹底的な，徹底した, てっていてきな，てっていした
7,trustee, トゥラスティー, 受託会社，受託者, じゅたくがいしゃ，じゅたくしゃ
7,drowsy, ドゥラウジー, 眠けを誘う，眠い, ねむけをさそう，ねむい
7,trifle, トゥライフル, (金・時間・精力などをを)浪費する，粗末にする, (きん・じかん・せいりょくなどをを)ろうひする，そまつにする
7,domain, ドウメイン, 領地，領土, りょうち，りょうど
7,dome, ドウム, 丸天井, まるてんじょう
7,dose, ドウス, 一服, いっぷく
7,doom, ドゥーム, 悲運，凶運, ひうん，きょううん
7,twig, トゥィッグ, 認める，小枝, みとめる，こえだ
7,toil, トイル, 骨折り，苦しい仕事, ほねおり，くるしいしごと
7,temporarily, テンポラリリー, 仮りに，仮に, かりりに，かりに
7,tempest, テンペストゥ, あらし，嵐, あらし，あらし
7,temperate, テンパレイトゥ, 穏やかな，節度のある, おだやかな，せつどのある
7,density, デンシティー, 密集度，濃さ, みっしゅうど，こさ
7,den, デン, 動物の住む穴，動物園の檻, どうぶつのすむあな，どうぶつえんのおり
7,territorial, テリトリアル, 領土の, りょうどの
7,delegate, デリゲイトゥ, 代理人，代表者, だいりにん，だいひょうしゃ
7,delegation, デリゲイション, 代表団，代議員団, だいひょうだん，だいぎいんだん
7,teller, テラー, 窓口係, まどぐちがかり
7,duration, デュレイション, 持続，持続期間, じぞく，じぞくきかん
7,dutiful, デューティフル, 従順な, じゅうじゅんな
7,deafen, デフン, 聴覚を奪う, ちょうかくをうばう
7,debut, デビュー, 初舞台，初演, はつぶたい，しょえん
7,testify, テスティファイ, 証明する，証言する, しょうめいする，しょうげんする
7,texture, テクスチャー, 織り目，構成, おりめ，こうせい
7,textile, テクスタイル, 織物(の)，編み物(の), おりもの(の)，あみもの(の)
7,timber, ティンバー, 材木，木材, ざいもく，もくざい
7,diligence, ディリジェンス, 勤勉, きんべん
7,tyranny, ティラニー, 暴虐行為，暴虐, ぼうぎゃくこうい，ぼうぎゃく
7,dependency, ディペンデンシー, 依存(の状態)，属国, いぞん(のじょうたい)，ぞっこく
7,developmental, ディベロップメンタル, 開発の，開発的な, かいはつの，かいはつてきな
7,diplomacy, ディプロマシー, 外交(手腕)，駆引き, がいこう(しゅわん)，かけひき
7,diploma, ディプロウマ, 卒業証書，公文書, そつぎょうしょうしょ，こうぶんしょ
7,deficiency, ディフィシェンシー, 不足，欠乏, ふそく，けつぼう
7,differentiate, ディファレンシエイトゥ, 他と別のものにする，区別する, ほかとべつのものにする，くべつする
7,dividend, ディビデンドゥ, 公債利息，(株の)配当金, こうさいりそく，(かぶの)はいとうきん
7,devour, ディバウアー, むさぼり食う，破滅させる, むさぼりくう，はめつさせる
7,detach, ディタッチ, 引き離す，取り外す, ひきはなす，とりはずす
7,detergent, ディタージェントゥ, 洗剤，洗浄剤, せんざい，せんじょうざい
7,desolate, ディソレトゥ, ひとけのない，荒れ果てた, ひとけのない，あれはてた
7,dismay, ディスメイ, うろたえさせる，うろたえさす, うろたえさせる，うろたえさす
7,dismal, ディズマル, 気味の悪い，陰気な, きみのわるい，いんきな
7,dispatch, ディスパッチ, 急送(する)，発送(する), きゅうそう(する)，はっそう(する)
7,distort, ディストートゥ, 歪曲する，歪める, わいきょくする，ゆがめる
7,distorted, ディストーティドゥ, ゆがめられた，歪んだ, ゆがめられた，ゆがんだ
7,destroyer, ディストゥロイアー, 破壊するもの，破壊者, はかいするもの，はかいしゃ
7,distributor, ディストゥリビューター, 代理店, だいりてん
7,dissatisfied, ディスサティスファイドゥ, 不満を示す，不快を示す, ふまんをしめす，ふかいをしめす
7,discard, ディスカードゥ, 捨てる，解雇する, すてる，かいこする
7,dishonor, ディスオゥナー, 屈辱をあたえる, くつじょくをあたえる
7,deceitful, ディシートゥフル, うそつきの, うそつきの
7,disastrous, ディザストゥラス, 悲惨な, ひさんな
7,disciple, ディサイプル, 弟子, でし
7,decisive, ディサイシブ, 決定的な，断固とした, けっていてきな，だんことした
7,dictate, ディクテイトゥ, 書き取らせる，口述する, かきとらせる，こうじゅつする
7,dictation, ディクテイション, 書き取り, かきとり
7,dean, ディーン, 学部長, がくぶちょう
7,deem, ディーム, 意見をもつ，思う, いけんをもつ，おもう
7,tedious, ティーディアス, たいくつな，退屈な, たいくつな，たいくつな
7,tearful, ティァフル, 涙ぐんだ, なみだぐんだ
7,chore, チョアー, 家庭での雑用，雑用, かていでのざつよう，ざつよう
7,chancellor, チャンセラー, ドイツの首相, ドイツのしゅしょう
7,chariot, チャリオットゥ, (古代の)一人乗り軽三輪戦車，立派な馬車, (こだいの)ひとりのりけいみわせんしゃ，りっぱなばしゃ
7,chap, チャップ, 男，あかぎれ, おとこ，あかぎれ
7,chatter, チャター, おしゃべり，ぺちゃくちゃしゃべる, おしゃべり，ぺちゃくちゃしゃべる
7,chuckle, チャクル, くすくす笑う, くすくすわらう
7,chime, チャイム, 調和(する)，チャイム, ちょうわ(する)，チャイム
7,chick, チック, 女の子，ヒヨコ, ヒヨコ
7,cherish, チェリッシュ, 大事にする，かわいがる, だいじにする，かわいがる
7,chestnut, チェスナットゥ, クリ，栗, クリ，くり
7,tumble, タンブル, 転倒する，宙返りする, てんとうする，ちゅうがえりする
7,tanker, タンカー, 油送船，タンカー, ゆそうせん，タンカー
7,tan, タン, なめす，皮をなめす, なめす，かわをなめす
7,tariff, タリフ, 関税，関税率, かんぜい，かんぜいりつ
7,dazzle, ダズル, の目をくらませる，まぶしくする, のめをくらませる，まぶしくする
7,duster, ダスター, 掃除人，雑巾, そうじじん，ぞうきん
7,dusk, ダスク, 黄昏, たそがれ
7,directive, ダイレクティブ, 指令する, しれいする
7,tile, タイル, タイル，かわら, タイル，かわら
7,tyrant, タイラントゥ, 暴君，圧制者, ぼうくん，あっせいしゃ
7,timing, タイミング, タイミング，機を得ること, タイミング，きをえること
7,timer, タイマー, タイマー, タイマー
7,divert, ダイバートゥ, 方向転換する，転換する, ほうこうてんかんする，てんかんする
7,dining, ダイニング, 食事, しょくじ
7,tidal, タイダル, 潮の，干満のある, しおの，かんまんのある
7,dialect, ダイアレクトゥ, 方言, ほうげん
7,diameter, ダイアメター, 直径，倍率, ちょっけい，ばいりつ
7,diagnosis, ダイアグノウシス, 診断, しんだん
7,soloist, ソロイストゥ, ソリスト，独奏者, ソリスト，どくそうしゃ
7,sophomore, ソフォモア,二年生，2年目の人,にねんせい，2ねんめのひと
7,thaw, ソー, (雪が)解ける，緊張が緩和する, (ゆきが)とける，きんちょうがかんわする
7,sown, ソウン, sowの過去分詞，植え付けられた, sowのかこぶんし，うえつけられた
7,socialism, ソウシャリズム, 社会主義, しゃかいしゅぎ
7,sentimental, センティメンタル, 感情的な，心情的な, かんじょうてきな，しんじょうてきな
7,sensational, センセイショナル, 扇情的な, せんじょうてきな
7,census, センサス, 人口調査，国勢調査, じんこうちょうさ，こくせいちょうさ
7,ceremonial, セレモニアル, 儀式上の，儀式, ぎしきじょうの，ぎしき
7,selective, セレクティブ, 選択の，注意深く選ぶ, せんたくの，ちゅういぶかくえらぶ
7,cellar, セラー, 地下室，貯蔵室, ちかしつ，ちょぞうしつ
7,sexuality, セクシュアリティー, 性別，性欲, せいべつ，せいよく
7,sane, セイン, 正気の，良識のある, しょうきの，りょうしきのある
7,slot, スロットゥ, 組み込む，溝をつける, くみこむ，みぞをつける
7,threshold, スレショウルドゥ, 敷居，発端, しきい，ほったん
7,slay, スレイ, 殺害する，殺す, さつがいする，ころす
7,sleeper, スリーパー, 眠っている人/動物，睡眠者, ねむっているひと/どうぶつ，すいみんしゃ
7,slumber, スランバー, 無為に過す，眠り, むいにすごす，ねむり
7,slant, スラントゥ, 傾斜，傾向, けいしゃ，けいこう
7,slang, スラング, スラング，俗語, スラング，ぞくご
7,slug, スラグ, 詰め物をする，なまける, つめものをする，なまける
7,thrive, スライブ, 成長する，生き甲斐にする, せいちょうする，いきかいにする
7,sly, スライ, 陰険な，ずるい, いんけんな，ずるい
7,smog, スモグ, スモッグ，煙霧, スモッグ，えんむ
7,spontaneous, スポンテイニアス, 自発的な，自然な, じはつてきな，しぜんな
7,sponsorship, スポンサーシップ, 後援，資金提供, こうえん，しきんていきょう
7,spotted, スポッティドゥ, まだらの，しみ・よごれのある, まだらの，しみ・よごれのある
7,spoke, スポウク, speakの過去形，スポーク, speakのかこけい，スポーク
7,specimen, スペッスメン, 見本の，標本, みほんの，ひょうほん
7,splendor, スプレンダー, 輝き，豪華, かがやき，ごうか
7,splash, スプラッシュ, ねる，はねかける, ねる，はねかける
7,spear, スピアー, やり，槍, やり，やり
7,spike, スパイク, スパイク，釘を刺す, スパイク，くぎをさす
7,sparkling, スパークリング, きらめく，発泡性の, きらめく，はっぽうせいの
7,spur, スパー, 駆り立てる，拍車をあてる, かりたてる，はくしゃをあてる
7,snore, スノアー, いびきをかく，いびき, いびきをかく，いびき
7,snail, スネイル, カタツムリ，不精者, カタツムリ，ぶしょうしゃ
7,snare, スネアー, 誘惑(する)，わな(に・をかける), ゆうわく(する)，わな(に・をかける)
7,stopper, ストッパー, 止め具，妨害物, とめぐ，ぼうがいぶつ
7,strand, ストゥランドゥ, 座礁する(させる)，岸に上がる, ざしょうする(させる)，きしにあがる
7,striker, ストゥライカー, ストライキをする人，撃鉄, ストライキをするひと，げきてつ
7,steward, ステュワードゥ, 幹事，給仕, かんじ，きゅうじ
7,stiffen, スティフン, 堅くする，こわばらせる, かたくする，こわばらせる
7,staple, ステイプル, 中心部，原料, ちゅうしんぶ，げんりょう
7,stapler, ステイプラー, ホッチキス, ホッチキス
7,stationery, ステイショナリー, 文房具，便箋, ぶんぼうぐ，びんせん
7,stance, スタンス, 姿勢, しせい
7,stab, スタブ, 刺す，中傷する, さす，ちゅうしょうする
7,static, スタティック, 静止した，空電, せいしした，そらでん
7,statistical, スタティスティカル, 統計的な，統計(上)の, とうけいてきな，とうけい(うえ)の
7,stout, スタウトゥ, 頑丈な，丈夫な, がんじょうな，じょうぶな
7,stylistic, スタイリスティック, 文体の, ぶんたいの
7,squash, スクワッシュ, つぶれる，つぶす, つぶれる，つぶす
7,scoop, スクープ, すくいあげる，ひとすくい, すくいあげる，ひとすくい
7,scanty, スキャンティー, わずかな，狭い, わずかな，せまい
7,scandalous, スキャンダラス, あきれった，恥ずべき, あきれった，はずべき
7,skim, スキム, すくい取る，かすめて飛ぶ, すくいとる，かすめてとぶ
7,skinny, スキニー, 皮と骨ばかりの，やせこけた, かわとほねばかりの，やせこけた
7,scarlet, スカーレットゥ, 深紅色，緋, しんくいろ，ひ
7,swelling, スェリング, 膨れる，隆起した, ふくれる，りゅうきした
7,souvenir, スーベニアー, 記念品，土産, きねんひん，みやげ
7,supervise, スーパバイズ, 監督(管理)する, かんとく(かんり)する
7,superstition, スーパスティション, 迷信, めいしん
7,soothe, スーズ, なだめる，和らげる, なだめる，やわらげる
7,swarm, スウォーム, いっぱいになる，群がる, いっぱいになる，むらがる
7,thicken, スィックン, 厚くする，太くする, あつくする，ふとくする
7,thicket, スィケットゥ, 茂み，やぶ, しげみ，やぶ
